Année;Livraison;Date;N° de notice;Page;Catégorie;Sous-Catégorie;Langue;Titre;Auteur;Posture;Affichage identitaire;Traducteur;Para-auteur;Nombre de feuilles;Fraction;Nombre de pages;Nombre de volumes;Format;Tirage 1;Illustrations 1;Nombre d'illustrations 1;Type de papier 1;Prix 1;Tirage 2;Illustrations 2;Nombre d'illustrations 2;Type de papier 2;Prix 2;Tirage 3;Illustrations 3;Nombre d'illustrations 3;Type de papier 3;Prix 3;Edition;Lieu d'édition;Imprimeur;Lieu d’impression;Lieu de vente 1;Libraire 1;Lieu de vente 2;Libraire 2;Lieu de vente 3;Libraire 3;Lieu de vente 4;Libraire 4;Lieu de vente 5;Libraire 5;Lieu de vente 6;Libraire 6;Lieu de vente 7;Libraire 7;Lieu de vente 8;Libraire 8;Lieu de vente 9;Libraire 9;Commentaires des bibliographes;Notes (e-BdF);Lien notice catalogue
1830;23;1830/06/05;3132;191;BELLES-LETTRES;Introduction et Langues;Anglais;"An English spelling-book ; with reading Lessons adapted to the capacities of children, in three parts. The forty second edition.";Lindley Murray;;;;;7;;252;;in-18;;;;;;;;;;;;;;;;;;Casimir;Paris;Paris, rue du Coq-Saint-Honoré;Baudry;Paris;Bobée;;;;;;;;;;;;;;;;;
1830;23;1830/06/05;3133;191;BELLES-LETTRES;Introduction et Langues;Anglais;The English Spelling-Book, with reading Lessons, accompanied by a progressive series of easy and familiar Lessons, intended as an introduction to the reading and spelling of the english language. 315th edition revised and improved.;W. Mavor;;;;;7;;168;;in-12;;;;;;;;;;;;;;;;;;Smith;Paris;Paris, rue du Coq-Saint-Honoré;Baudry;Paris;Bobée;;;;;;;;;;;;;;;;;
1830;23;1830/06/05;3135;214;BELLES-LETTRES;Philologie, Critique, Mélanges;Grec;Anecdota Graeca è codicibus regiis descripsit, annotatione illustravit J. Fr. Boissonade. Vol. II.;;Compilation;;;J. Fr. Boissonade;32 1/4;;516;;in-8°;;;;;;;;;;;;;;;;;;Impr. royale;Paris;Paris;Levrault;Strasbourg;Levrault;;;;;;;;;;;;;;;;;
1830;23;1830/06/05;3136;214;BELLES-LETTRES;Philologie, Critique, Mélanges;"Français;Grec";Lucien. Dialogues des morts, grec-français. Par M. M. Boulanger.;Lucien;;;;M. M. Boulanger;4 1/4;;102;;in-12;;;;;3,0;;;;;;;;;;;;;Aug. Delalain;Paris;Paris, rue des Mathurins-Saint-Jacques;Aug. Delalain;;;;;;;;;;;;;;;;;;;
1830;23;1830/06/05;3138;203;BELLES-LETTRES;Poétique et Poésie;"Français;Italien";Le Purgatoire de Dante Alighieri, traduit en français par M. le chevalier Artaud. Deuxième édition.;Dante Alighieri;;Noblesse;M. le chevalier Artaud;;12 1/8;;776;3;in-32;;une gravure;1;;10,0;;;;;;;;;;;;;F. Didot;Paris;;;;;;;;;;;;;;;;;;;"Le texte est en regard ; la première édition est anonyme ; voyez n. 1115 de 1813. La seconde édition de la traduction de l'Enfer, est aussi in-32 : voyez n. 4915 de 1828.";;
1830;23;1830/06/05;3139;"217;193";BELLES-LETTRES;"Poétique et Poésie;Polygraphes";Latin;A. Persius Flaccus cum interpretatione latina, lectionum varietate, adnotationibusque novis item Lucii fragmenta, satira Sulpiciae, curante A. Perreau : quod est satiricorum latinorum cum Juvenale. Volumen tertium et ultimum.;"Perse;Lucius";Compilation;;;A. Perreau;46;;736;;in-8°;;une planche;1;;;;;;;;;;;;;;;J. Didot aîné;Paris;Paris;N. E. Lemaire;;;;;;;;;;;;;;;;;115e volume faisant partie de la 58e livraison de la Bibliotheca classica latina.;;
1830;23;1830/06/05;3140;217;BELLES-LETTRES;Polygraphes;Français;Bibliothèque Latine-Française. XXXVIII livraison. Histoire romaine, de Tite-Live. Traduction nouvelle, par MM. A. A. J. Liez, N. A. Dubois, V. Verger (tome XIII).;Tite-Live;Collectif;;"M. A. A. J. Liez;M. N. A. Dubois;M. V. Verger";;24 1/2;;392;;in-8°;;;;;7,0;;;;;;;;;;;;;Panckoucke;Paris;Paris, rue des Poitevins, n. 14;Panckoucke;;;;;;;;;;;;;;;;;;;
1830;23;1830/06/05;3141;217;BELLES-LETTRES;Polygraphes;Français;Collection complète des auteurs latins, avec traduction nouvelle en regard, etc. Par M. E. Boutmy. Tome II.;;Compilation;;;M. E. Boutmy;16;;384;;in-12;;;;;;;;;;;;;;;;;;Locquin;Paris;Paris, rue Dauphine, n. 24;;Paris, rue Thérèse, n. 4;;;;;;;;;;;;;;;;;;
1830;23;1830/06/05;3142;"217;193";BELLES-LETTRES;"Poétique et Poésie;Polygraphes";Latin;In opera P. Papinii Statii cum testimoniis recensu codicum et notitia litteraria index universus rerum, nominum et vocabulorum quem plane confecit et disposuit N. E. Lemaire. Volumen quartum et ultimum.;;;;;N. E. Lemaire;42;;672;;in-8°;;;;;;;;;;;;;;;;;;A. Pihan Delaforest;Paris;Paris, rue des Quatre-Fils, au Marais, n. 16;N. E. Lemaire;;;;;;;;;;;;;;;;;"Ce volume est le quatrième, non de l'Index (qui n'a que ce volume), mais des Oeuvres de Stace. C'est le tome 116 faisant partie de la 58e livraison de la Bibliotheca classica latina. Dans l'annonce du 3e volume de Stace (voyez n. 127 de 1828), j'ai mis : de l'imprimerie de Lemaire, etc. ; lisez : De l'imprimerie de J. Didot aîné.";;
1830;23;1830/06/05;3143;193;BELLES-LETTRES;Poétique et Poésie;"Français;Latin";Les Satires de Juvénal, traduites en vers français et suivies des Lettres à Philinte sur l'intelligence de ce poète et ses beautés rapprochées de celles d'Horace dans les sujets traités par ces deux auteurs. Par Barré de Jallaix.;Juvénal;;;Barré de Jallaix;Barré de Jallaix;56 1/4;;900;2;in-8°;;;;;15,0;;;;;;;;;;;;;Jules Didot l'aîné;Paris;Paris;Brissot-Thivars;;;;;;;;;;;;;;;;;Plus un prospectus d'une demi-feuille. Le texte est en regard.;;
1830;23;1830/06/05;3144;215;BELLES-LETTRES;Philologie, Critique, Mélanges;Portugais;Treplica ao Padre Amaro, pelo estudante emigrado.;estudante emigrado;Pseudonyme masculin;"Enseignement;Autres";;;1 1/4;;20;;in-8°;;;;;;;;;;;;;;;;;;Tastu;Paris;;;;;;;;;;;;;;;;;;;Voyez n. 2902, 5058 et 6714 de 1829.;;
1830;24;1830/06/12;3147;200;BELLES-LETTRES;Poétique et Poésie;Français;Apothéose (en vers) de S. M. Louis XVI, Roi de France.;F. F. Legrand;;;;;0 1/4;;4;;in-8°;;;;;;;;;;;;;;;;;;Carpentier-Méricourt;Paris;;;;;;;;;;;;;;;;;;;Vingt vers de six syllabes signés F. F. Legrand.;;
1830;24;1830/06/12;3160;212;BELLES-LETTRES;Romans et Contes;Français;"Cloudesley. Par William Godwin, auteur de Caleb Williams ; traduit de l'anglais par Jean Cohen.";William Godwin, auteur de Caleb Williams;;;Jean Cohen;;39;;936;4;in-12;;;;;12,0;;;;;;;;;;;;;Cosson;Paris;Paris;Fournier jeune;;;;;;;;;;;;;;;;;;;
1830;24;1830/06/12;3164;209;BELLES-LETTRES;Théâtre;Français;Cordelia, opéra en un acte, musique de M. Kreutzer.;;Anonyme;;;;0 1/2;;8;;in-8°;;;;;;;;;;;;;;;;;;Vinchon;Paris;;;;;;;;;;;;;;;;;;;Analyse en français.;;
1830;24;1830/06/12;3167;190;BELLES-LETTRES;Introduction et Langues;Français;Cours général de langue française, en 30 leçons. Ouvrage rédigé sur un plan tout-à-fait neuf.;M. Pons;;;;;20;;320;;in-8°;;;;;6,0;;;;;;;;;;;;;Carpentier-Méricourt;Paris;Paris;Werdet;;;;;;;;;;;;;;;;;;;
1830;24;1830/06/12;3174;201;BELLES-LETTRES;Poétique et Poésie;Français;Description du départ de l'armée française et de la flotte pour l'expédition d'Alger.;;Anonyme;;;;0 3/4;;12;;in-8°;;;;;;;;;;;;;;;;;;madame veuve Guichard;Avignon;;;;;;;;;;;;;;;;;;;En vers.;;
1830;24;1830/06/12;3180;201;BELLES-LETTRES;Poétique et Poésie;Français;"Epître sur l'expédition d'Alger ; suivie d'une anecdote militaire.";Louis-Charles Leduc;;;;;1;;16;;in-8°;;;;;;;;;;;;;;;;;;madame veuve Cluzeau;Saint-Esprit;;;;;;;;;;;;;;;;;;;En vers.;;
1830;24;1830/06/12;3182;191;BELLES-LETTRES;Introduction et Langues;Français;Grammaire pratique de la langue allemande. Par J. V. Meidinger. Quinzième édition, précédée d'un Traité de prononciation, par F. G. Eichhoff.;J. V. Meidinger;;;;F. G. Eichhoff;19 3/4;;316;;in-8°;;;;;;;;;;;;;;;;;;Smith;Paris;Paris, rue du Coq-Saint-Honoré;Baudry;Paris;Bobée;;;;;;;;;;;;;;;Plus un modèle d'écriture.;;
1830;24;1830/06/12;3190;210;BELLES-LETTRES;Romans et Contes;Français;Histoire de Gil Blas de Santillane.;Lesage;;;;;81 3/4;;1308;3;in-8°;;;;;2,25;;;;;;;;;;;;;Barbier;Paris;Paris, rue de Vaugirard, n. 17;Houdaille;Paris;Corbet aîné;Paris;Lecointe;;;;;;;;;;;;;Prix de chaque volume : 2-25.;;
1830;24;1830/06/12;3217;201;BELLES-LETTRES;Poétique et Poésie;Français;Ode à l'occasion du mariage de S. M. le roi d'Espagne.;D... de M.;Anonyme;;;;1;;8;;in-4°;100;;;;;;;;;;;;;;;;;Firmin Didot;Paris;;;;;;;;;;;;;;;;;;;"Signé D... de M.; tiré à cent : ne se vend pas.";;
1830;24;1830/06/12;3218;"217;205";BELLES-LETTRES;"Théâtre;Polygraphes";Français;Oeuvres choisies de Boissy. Tome Ier.;Boissy;;;;;6 2/3;;240;;in-18;;;;;0,60;;;;;;;;;;;;;Lachevardière;Paris;Paris, quai des Augustins, n. 49;Lecointe;;;;;;;;;;;;;;;;;Fait partie de la Nouvelle bibliothèque des classiques français.;;
1830;24;1830/06/12;3219;"217;205";BELLES-LETTRES;"Théâtre;Polygraphes";Français;Oeuvres choisies de Chateaubrun et de Guimond de Latouche.;"Chateaubrun;Guimond de Latouche";Compilation;;;;4 5/6;;174;;in-18;;;;;0,50;;;;;;;;;;;;;Lachevardière;Paris;Paris, quai des Augustins, n. 49;Lecointe;;;;;;;;;;;;;;;;;Fait partie de la Nouvelle bibliothèque des classiques français.;;
1830;24;1830/06/12;3221;217;BELLES-LETTRES;Polygraphes;Français;Oeuvres complètes de Buffon, augmentées par M. F. Cuvier de deux volumes supplémentaires. (Tome XXIII.) Oiseaux. Tome V.;"Buffon;M. F. Cuvier";;;;;30;;480;;in-8°;;;;;2,25;;;;;;;;;;;;;Moessard;Paris;Paris, rue de Seine-Saint-Germain, n. 49;;Paris;Salmon;;;;;;;;;;;;;;;Prix de chaque volume : 2-25.;;
1830;24;1830/06/12;3222;217;BELLES-LETTRES;Polygraphes;Français;"Oeuvres complètes de Buffon, avec les suites par M. de Lacépède ; précédées d'une Notice sur la vie et les ouvrages de Buffon, par M. le baron Cuvier. Nouvelle édition, ornée de figures gravées d'après les dessins de Prêtre. Tomes XXXIV et XXXV.";"Buffon;M. de Lacépède";Compilation;Noblesse;;"Prêtre;M. le baron Cuvier";10;;360;2;in-18;;;;;0,60;;cahier de planches (figures gravées);;;0,9;;;;;;;;Decourchant;Paris;Paris, quai des Augustins, n. 49;Lecointe;;;;;;;;;;;;;;;;;L'édition aura 80 volumes.;;
1830;24;1830/06/12;3223;217;BELLES-LETTRES;Polygraphes;Français;Oeuvres complètes de Jacques-Henri Bernardin de Saint-Pierre, augmentées de divers morceaux inédits, mises en ordre et précédées de la vie de l'auteur. Par L. Aimé Martin. (Tome IV.) Etudes de la nature, tome II.;Jacques-Henri Bernardin de Saint-Pierre;;;;L. Aimé Martin;27;;432;;in-8°;;;;;2,25;;;;;;;;;;;;;Pinard;Paris;Paris;Lequien fils;Paris;Pinard;;;;;;;;;;;;;;;Voyez n. 2393.;;
1830;24;1830/06/12;3224;218;BELLES-LETTRES;Polygraphes;Français;Oeuvres complètes de Voltaire, avec des notes, préfaces, avertissemens, remarques historiques et littéraires. (Tome XLVII) Correspondance générale, tome VI.;Voltaire;Pseudonyme;;;;31;;496;;in-8°;;;;;2,25;;;;;;;;;;;;;Rignoux;Paris;Paris, rue Taranne, n. 14;;;;;;;;;;;;;;;;;;XLIe livraison de l'édition annoncée en 50 volumes in-8°.;;
1830;24;1830/06/12;3225;217;BELLES-LETTRES;Polygraphes;Français;Oeuvres de Blaise Pascal, précédées d'une Notice sur l'auteur, par M. Népomucène L. Lemercier. (Tome II). Les Pensées.;Blaise Pascal;Collectif;;;M. Népomucène L. Lemercier;26 1/4;;420;;in-8°;;;;;;;;;;;;;;;;;;Tastu;Paris;Paris, rue Taranne, n. 14;;;;;;;;;;;;;;;;;;Le premier volume de cette édition se compose du n. 2091 de 1829, pour lequel on a refait les faux-titre et titre avec l'adresse rue Taranne, n. 14.;;
1830;24;1830/06/12;3226;204;BELLES-LETTRES;Poétique et Poésie;Français;"Oeuvres de Lord Byron. Traduction de M. A. Pichot ; précédées d'un Essai sur la vie et le caractère de lord Byron, par le traducteur, et d'un Discours préliminaire, de M. Charles Nodier.";Lord Byron;;Noblesse;M. A. Pichot;"M. A. Pichot;M. Charles Nodier";26;;416;;in-8°;;;;;2,50;;;;;;;;;;;;;Lachevardière;Paris;Paris, quai des Augustins;Furne;;;;;;;;;;;;;;;;;L'édition aura 6 volumes, plus deux volumes de supplément auxquels on sera libre de ne pas souscrire et qui contiendront les journaux et lettres récemment publiés par Th. Moore. Prix de chacun : 2-25.;;
1830;24;1830/06/12;3229;192;BELLES-LETTRES;Rhétorique et Eloquence;Français;Panégyriques, oraisons funèbres et autres discours de M. de Boulogne, évêque de Troyes.;M. de Boulogne, évêque de Troyes;;"Religion;Contexte géographique";;;9 1/6;;220;;in-12;;;;;3;;;;;;;;;;;;;Leclère;Paris;Paris, quai des Augustins;Leclère;;;;;;;;;;;;;;;;;Ce volume est le seul des Œuvres primitives qui ait été réimprimé dans le format in-12.;;
1830;24;1830/06/12;3232;213;BELLES-LETTRES;Romans et Contes;Français;Le Pirate (The Pirate). Traduction de M. Defauconpret, avec des éclaircissemens et des notes historiques.;Walter Scott;;;M. Defauconpret;M. Defauconpret;38;;608;;in-8°;;;;;2,25;;;;;;;;;;;;;Lachevardière;Paris;Paris, quai des Augustins;Furne;;;;;;;;;;;;;;;;;XIe livraison et tome XV des OEuvres de Walter Scott.;;
1830;24;1830/06/12;3233;204;BELLES-LETTRES;Théâtre;Français;"Précis de dramatique, ou De l'art de composer et exécuter les pièces de théâtre, contenant l'exposé et la discussion des règles adoptées par les anciens et par les modernes, l'examen de celles qu'on tente de leur substituer, les formes, les divisions, le style propre aux œuvres dramatiques, les règles particulières à la tragédie, la comédie, la tragi-comédie, le drame, le mélodrame, le drame lyrique, opéra, opéra-comique, vaudevilles, les genres secondaires, etc.; suivi de l'Art du comédien, la déclamation et le geste théâtral, et du matériel de l'art dramatique, décorations, théâtres, costumes, etc.; précédé d'une Introduction historique, et suivi d'une Biographie, d'une Bibliographie et d'un Vocabulaire analytique.";M. Viollet Leduc, auteur du Précis de poétique et de versification;;Métiers du livre;;M. Bailly de Merlieux;;;;;grand in-32;;un frontispice;1;papier vélin;3,50;;;;;;;;;;;;;Decourchant;Paris;Paris, rue du Jardinet, n. 8;bureau de l'Encyclopédie portative;Paris;Bachelier;;;;;;;;;;;;;;;Prix, séparément : 3-50. Cet ouvrage forme la 43e livraison de l'édition in-32 de l'Encyclopédie portative, dirigée par M. Bailly de Merlieux.;;
1830;24;1830/06/12;3235;210;BELLES-LETTRES;Romans et Contes;"Français;Allemand";"Premier livre de Télémaque, en allemand, avec la version française littérale interlinéaire, ou Epitome pour apprendre en peu de tems et sans maître la langue allemande suivant la méthode Jacotot ; précédé d'une Notice historique sur la langue allemande et d'un Traité de la prononciaition. Par P. A. Guilbaud.";;Anonyme;;P. A. Guilbaud;P. A. Guilbaud;3 1/6;;76;;in-12;;;;;;;;;;;;;;;;;;Renouard;Paris;Paris, rue Dauphine, n. 24;Froment;;;;;;;;;;;;;;;;;;;
1830;24;1830/06/12;3244;194;BELLES-LETTRES;Poétique et Poésie;Français;Romances, ballades et légendes.;M. Boucher de Perthes;;;;;11 2/9;;;;in-12;;;;;5,0;;;;;;;;;;;;;Pinard;Paris;Paris, rue de Bourbon, n. 17;Treuttel et Würtz;;;;;;;;;;;;;;;;;;Contradiction entre le format in-12 et le nombre de 11 feuilles 2/9 (JBM).;
1830;24;1830/06/12;3250;196;BELLES-LETTRES;Poétique et Poésie;Français;Vers sur le parc de Mousseaux, présenté (sic) à S. R. Mgr le duc d'Orléans, qui a daigné en accepter l'hommage.;F. F. Legrand;;;;;0 1/4;;4;;in-8°;;;;;;;;;;;;;;;;;;Carpentier-Méricourt;Paris;;;;;;;;;;;;;;;;;;;Quatre vers alexandrins, signés F. F. Legrand.;;
1830;24;1830/06/12;3259;192;BELLES-LETTRES;Poétique et Poésie;"Français;Grec";Homère, second chant de l'Iliade : texte en regard, avec deux traductions, l'une interlinéaire et l'autre correcte. Par E. Boutmy.;Homère;;;E. Boutmy;;8 3/4;;140;;in-8°;;;;;2,50;;;;;;;;;;;;;Mme veuve Thuau;Paris;Paris, rue de l'Ecole-de-Médecine, n. 4;Mansut fils;;;;;;;;;;;;;;;;;VIIe livraison du Manuel grec pour le baccalauréat ès-lettres.;;
1830;24;1830/06/12;3261;217;BELLES-LETTRES;Polygraphes;Latin;Collection complète des auteurs latins, avec traduction nouvelle en regard, etc. Par M. E. Boutmy. Tome VI.;;Compilation;;;M. E. Boutmy;9 1/2;;228;;in-12;;;;;;;;;;;;;;;;;;Locquin;Paris;Paris, rue Dauphine, n. 24;;Paris, rue Thérèse, n. 4;;;;;;;;;;;;;;;;;;
1830;24;1830/06/12;3262;193;BELLES-LETTRES;Poétique et Poésie;"Latin;Français";Infanti Regio Burdigalensium Duci.;F. D. Budan de Bois-Laurent;;;;;0 1/4;;4;;in-8°;;;;;;;;;;;;;;;;;;Dondey-Dupré;Paris;;;;;;;;;;;;;;;;;;;Centon virgilien de 22 vers. En regard est une paraphrase française signée F. D. Budan de Bois-Laurent.;;
1830;24;1830/06/12;3263;218;BELLES-LETTRES;Mythologie et Fables;Latin;"Phædri, Aug. Liberti, fabularum Esopiarum libros quatuor, ex codice olim pithæano, deinde peletteriano, nunc in bibliothecâ viri excellentissimi ac nobilissimi Lud. Lepeletier de Rosanbo Marchionis, Paris Franciæ, amplissimo senatui à secretis, etc., etc., contextu codicis nunc primùm integre in lucem prolato, adjectaque varietate lectionis è codice remensi, incendio consumpto, à dom. Vincentio olim enotata, cum prolegomenis, annotatione, indice; edidit Julius Berger de Xivrey.";Phèdre, affranchi d'Auguste;;Autres;;Julius Berger de Xivrey;16 5/8;;266;;in-8°;200;;;;20,0;;;;;;;;;;;;;F. Didot;Paris;Paris, rue Jacob, n. 24;F. Didot;;;;;;;;;;;;;;;;;Tiré à 200 : la préface en français a 86 pages.;;
1830;25;1830/06/19;3273;216;BELLES-LETTRES;Philologie, Critique, Mélanges;Français;Bonapartiana, ou Recueil choisi d'anecdotes, de traits sublimes, de bons mots, de saillies, de pensées ingénieuses, de réflexions profondes de Napoléon Bonaparte, avec un aperçu des actions les plus belles et les plus éclatantes de sa vie. Seconde édition, revue, etc.;Cousin d'Avalon;;;;;10;;360;;in-18;;;;;2,0;;;;;;;;;;;;;Henry;Paris;Paris;Corbet aîné;;;;;;;;;;;;;;;;;Seconde édition, revue, etc.;;
1830;25;1830/06/19;3277;205;BELLES-LETTRES;Théâtre;Français;Chefs-d'oeuvre dramatiques de Voltaire.;Voltaire;Pseudonyme;;;;37;;1332;4;in-18;;;;;;;;;;;;;;;;;;Mame;Tours;Tours;Mame;;;;;;;;;;;;;;;;;;;
1830;25;1830/06/19;3287;195;BELLES-LETTRES;Poétique et Poésie;Français;La Démagogie en voyage, poëme en un seul chant, orné d'une lithographie, et suivi d'une épître à M. Michaud, académicien.;Jean Bouche-d'Or;Pseudonyme masculin;;;;1;;16;;in-8°;;une lithographie;1;;1,0;;;;;;;;;;;;;Locquin;Paris;Paris;Levavasseur;Paris;Dentu;Paris;Delangle;;;;;;;;;;;;;Suivi d'une épître à M. Michaud, académicien.;;
1830;25;1830/06/19;3296;212;BELLES-LETTRES;Romans et Contes;Français;"Eléonore d'Autriche, ou la Captivité de François 1er ; le Connétable de Bourbon, ou le Danger des passions ; nouvelles historiques.";M. Battur;;;;;13 1/2;;216;;in-8°;;;;;5,0;;;;;;;;;;;;;Ad. Leclère;Paris;Paris, rue des Grands-Augustins, n. 7;Pillet aîné;;;;;;;;;;;;;;;;;;;
1830;25;1830/06/19;3297;192;BELLES-LETTRES;Rhétorique et Eloquence;Français;Eloge de Jeanne d'Arc, à l'occasion de la délivrance de la ville d'Orléans, le 8 mai 1429, préché dans la cathédrale d'Orléans le 8 mai 1830 par M. l'abbé Le Courtier.;M. l'abbé Le Courtier;;Religion;;;3;;48;;in-8°;;;;;;;;;;;;;;;;;;Rouzeau-Montau;Orléans;;;;;;;;;;;;;;;;;;;;;
1830;25;1830/06/19;3299;196;BELLES-LETTRES;Poétique et Poésie;Français;Epître à la société d’agriculture, sciences et arts du département de la Dordogne.;M. le baron de Gageac;;Noblesse;;;6 1/4;;100;;in-8°;;;;;;;;;;;;;;;;;;Dupont;Périgueux;Périgueux;Dupont;;;;;;;;;;;;;;;;;En vers, suivis de notes.;La table systématique et donc la version abrégée indiquent le n° 3399 au lieu de 3299 (JBM).;
1830;25;1830/06/19;3303;218;BELLES-LETTRES;Mythologie et Fables;Français;Fables de Fénelon. Nouvelle édition.;Fénelon;;;;;5 1/2;;198;;in-18;;12 gravures;12;;1,80;;;;;;;;;;;;;Casimir;Paris;Paris, quai des Augustins, n. 31;Ledentu;;;;;;;;;;;;;;;;;;;
1830;25;1830/06/19;3305;197;BELLES-LETTRES;Poétique et Poésie;Français;La Fête-Dieu, ode dédiée à S. A. R. madame_la_Dauphine.;M. Emile Roulland;;;;;1 1/4;;20;;in-8°;;;;;;;;;;;;;;;;;;Duverger;Paris;Paris, galerie Véro-Dodat, n. 1;;;;;;;;;;;;;;;;;;;;
1830;25;1830/06/19;3308;217;BELLES-LETTRES;Polygraphes;Français;Génie du Christianisme. Tome VIII (et dernier).;M. le vicomte de Châteaubriand;;Noblesse;;;14 1/2;;348;;in-12;;;;;4,0;;;;;;;;;;;;;Fournier;Paris;Paris;Fournier jeune;Paris;Fayolle;;;;;;;;;;;;;;;Tome VIII des Oeuvres complètes de M. le vicomte de Châteaubriand, en 45 volumes in-12.;;
1830;25;1830/06/19;3311;194;BELLES-LETTRES;Poétique et Poésie;Français;Harmonies poétiques et religieuses.;Alphonse de Lamartine;;;;;43 3/4;;700;2;in-8°;;;;;16,0;;;;;;;;;;;;;Lachevardière;Paris;Paris, rue St.-Germain-des-Prés, n. 9;Gosselin;;;;;;;;;;;;;;;;;Deuxième édition. Deux volumes in-8°, ensemble de 43 feuilles 3/4.;;
1830;25;1830/06/19;3311;194;BELLES-LETTRES;Poétique et Poésie;Français;Harmonies poétiques et religieuses. Deuxième édition.;Alphonse de Lamartine;;;;;43 3/4;;700;2;in-8°;;;;;16,0;;;;;;;;;;;;;Lachevardière;Paris;Paris, rue St.-Germain-des-Prés, n. 9;Gosselin;;;;;;;;;;;;;;;;;Deuxième édition. Deux volumes in-8°, ensemble de 43 feuilles 3/4.;;
1830;25;1830/06/19;3315;192;BELLES-LETTRES;Poétique et Poésie;Français;"L'Iliade. Traduction nouvelle en vers français ; précédée d'un Essai sur la poésie homérique. Par A. Bignan. Tome second.";Homère;;;A. Bignan;A. Bignan;33 7/8;;542;;in-8°;;;;;;;;;;;;;;;;;;Gratiot;Paris;Paris;Belin-Mandar;;;;;;;;;;;;;;;;;;;
1830;25;1830/06/19;3317;217;BELLES-LETTRES;Philologie, Critique, Mélanges;Français;La Jeune Villageoise. Histoire véritable.;;Anonyme;;;;1 5/6;;44;;in-12;;;;;;;;;;;;;;;;;;Smith;Paris;Paris;Risler;;;;;;;;;;;;;;;;;N° 65 des Traités religieux.;;
1830;25;1830/06/19;3320;"217;218";BELLES-LETTRES;"Mythologie et Fables;Polygraphes";Français;Lettres à Emilie sur la mythologie. Tome Ier.;C. A. Demoustier;;;;;6 8/9;;248;;in-18;;;;;0,65;;;;;;;;;;;;;Marchand-Dubreuil;Paris;Paris, rue Saint-Jacques, n. 156;;;;;;;;;;;;;;;;;;67e et 68e livraisons de la Bibliothèque des amis des lettres.;;
1830;25;1830/06/19;3320;"217;218";BELLES-LETTRES;"Mythologie et Fables;Polygraphes";Français;Lettres à Emilie sur la mythologie. Tome second.;C. A. Demoustier;;;;;5 8/9;;212;;in-18;;;;;0,65;;;;;;;;;;;;;Marchand-Dubreuil;Paris;Paris, rue Saint-Jacques, n. 156;;;;;;;;;;;;;;;;;;67e et 68e livraisons de la Bibliothèque des amis des lettres.;;
1830;25;1830/06/19;3322;"217;214";BELLES-LETTRES;"Philologie, Critique, Mélanges;Polygraphes";Français;Mélanges historiques. Tome Ier.;Voltaire;Pseudonyme;;;;5 1/2;;198;;in-18;;;;;0,60;;;;;;;;;;;;;Lachevardière;Paris;Paris, quai des Augustins, n. 49;Lecointe;;;;;;;;;;;;;;;;;Fait partie de la Nouvelle bibliothèque des classiques français.;;
1830;25;1830/06/19;3323;215;BELLES-LETTRES;Philologie, Critique, Mélanges;Français;Mélanges, ou Suite des promenades d'un solitaire.;Charles d'Outrepont;;;;;14 1/2;;232;;in-8°;;;;;;;;;;;;;;;;;;F. Didot;Paris;Paris, rue Jacob, n. 24;F. Didot;;;;;;;;;;;;;;;;;;;
1830;25;1830/06/19;3327;197;BELLES-LETTRES;Poétique et Poésie;Français;Mes souvenirs de l'Italie, épître philosophique à leurs majestés le roi et la reine de Naples et des Deux-Siciles pendant leur séjour à Paris en mai 1830.;H. Geslaint;;;;;1;;8;;in-4°;;;;;;;;;;;;;;;;;;Guiraudet;Paris;;;;;;;;;;;;;;;;;;;;;
1830;25;1830/06/19;3328;215;BELLES-LETTRES;Philologie, Critique, Mélanges;Français;La Métempsycose, ou Dialogue des bétes.;Un pythagoricien;Pseudonyme masculin;;Autres;;4;;64;;in-8°;;;;;1,50;;;;;;;;;;;;;Firmin Didot;Paris;Paris, rue Jacob, n. 24;Firmin Didot;;;;;;;;;;;;;;;;;En prose.;;
1830;25;1830/06/19;3330;217;BELLES-LETTRES;Philologie, Critique, Mélanges;Français;Le Meurtre.;;Anonyme;;;;1;;16;;in-8°;;;;;;;;;;;;;;;;;;Roure;Privas;;;;;;;;;;;;;;;;;;;;;
1830;25;1830/06/19;3331;212;BELLES-LETTRES;Romans et Contes;Français;La Montagne de Saint-Lié, ou la Ferme champenoise.;Un jeune insulaire;Pseudonyme masculin;"Âge;Contexte géographique";;;13;;312;2;in-12;;;;;;;;;;;;;;;;;;Luton;Reims;Paris, place Saint-Germain-l'Auxerrois;Pigoreau;Reims;Ledoyen;Reims;Brissart-Carolet;;;;;;;;;;;;;;;
1830;25;1830/06/19;3333;"217;211";BELLES-LETTRES;"Romans et Contes;Polygraphes";Français;"Les Natchez, tome III ; Voyages en Amérique, tome Ier.";M. le vicomte de Chateaubriand;;Noblesse;;;18 1/3;;440;;in-12;;;;;4,0;;;;;;;;;;;;;Fournier;Paris;Paris;Fournier jeune;Paris;Fayolle;;;;;;;;;;;;;;;Tomes XII et XIII des Œuvres complètes de M. le vicomte de Chateaubriand, en 45 vol. in-12.;;
1830;25;1830/06/19;3333;"217;211";BELLES-LETTRES;"Romans et Contes;Polygraphes";Français;"Les Natchez, tome III ; Voyages en Amérique, tome II.";M. le vicomte de Chateaubriand;;Noblesse;;;20 1/6;;484;;in-12;;;;;4,0;;;;;;;;;;;;;Fournier;Paris;Paris;Fournier jeune;Paris;Fayolle;;;;;;;;;;;;;;;Tomes XII et XIII des Œuvres complètes de M. le vicomte de Chateaubriand, en 45 vol. in-12.;;
1830;25;1830/06/19;3338;"205;217";BELLES-LETTRES;Polygraphes;Français;Oeuvres choisies de Boissy. Tome second.;Boissy;;;;;5 2/3;;204;;in-18;;;;;0,60;;;;;;;;;;;;;Lachevardière;Paris;Paris, quai des Augustins, n. 49;Lecointe;;;;;;;;;;;;;;;;;Fait partie de la Nouvelle bibliothèque des classiques français.;;
1830;25;1830/06/19;3339;217;BELLES-LETTRES;Polygraphes;Français;Oeuvres complètes de Buffon, augmentées d'articles supplémentaires sur divers animaux qui n'étaient point connus de Buffon. Par M. le baron Cuvier. Tome XXXVI.;"M. le baron Cuvier;Buffon";Compilation;Noblesse;;;7;;252;;in-18;;;;;0,65;;;;;;;;;;;;;Gaultier-Laguionie;Paris;Paris;P. Dupont;;;;;;;;;;;;;;;;;L'édition aura 50 volumes.;;
1830;25;1830/06/19;3339;217;BELLES-LETTRES;Polygraphes;Français;Oeuvres complètes de Buffon, augmentées d'articles supplémentaires sur divers animaux qui n'étaient point connus de Buffon. Par M. le baron Cuvier. Gravures. XVe livraison.;;;;;;0 1/9;;4;;in-18;;cahier de planches (5 planches);5;;0,35;;cahier de planches (5 planches coloriées);5;;0,6;;;;;;;;Gaultier-Laguionie;Paris;Paris;P. Dupont;;;;;;;;;;;;;;;;;In-18 d'un neuvième de feuille servant de couverture, plus 5 planches. L'édition aura 50 volumes.;;
