Année;Livraison;Date;N° de notice;Page;Catégorie;Sous-Catégorie;Langue;Titre;Auteur;Posture;Affichage identitaire;Traducteur;Para-auteur;Nombre de feuilles;Fraction;Nombre de pages;Nombre de volumes;Format;Tirage 1;Illustrations 1;Nombre d'illustrations 1;Type de papier 1;Prix 1;Tirage 2;Illustrations 2;Nombre d'illustrations 2;Type de papier 2;Prix 2;Tirage 3;Illustrations 3;Nombre d'illustrations 3;Type de papier 3;Prix 3;Edition;Lieu d'édition;Imprimeur;Lieu d’impression;Lieu de vente 1;Libraire 1;Lieu de vente 2;Libraire 2;Lieu de vente 3;Libraire 3;Lieu de vente 4;Libraire 4;Lieu de vente 5;Libraire 5;Lieu de vente 6;Libraire 6;Lieu de vente 7;Libraire 7;Lieu de vente 8;Libraire 8;Lieu de vente 9;Libraire 9;Commentaires des bibliographes;Notes (e-BdF);Lien notice catalogue
1830;13;1830/03/27;1750;206;BELLES-LETTRES;Théâtre;Français;Réflexions d'un infirmier de l'hospice de la Pitié sur le drame d'Hernani, de M. Victor Hugo.;un infirmier de l'hospice de la Pitié;Pseudonyme masculin;Santé;;;3;;48;;in-8°;;;;;;;;;;;;;;;;;;Cosson;Paris;Paris, au Palais-Royal, galerie de Valois, n. 185;;;;;;;;;;;;;;;;;;;;
1830;13;1830/03/27;1753;206;BELLES-LETTRES;Théâtre;Français;Répertoire du théâtre de Madame. La Belle-mère. Seconde édition.;"M. Scribe;M. Bayard";Collectif;;;;1 1/2;;96;;grand in-32;;;;;1,00;;;;;;;;;;;;;Dondey-Dupré;Paris;Paris;Houdaille;Paris, vieille rue du Temple, n. 36;Pollet;;;;;;;;;;;;;;;Réimpression de la douzième livraison.;;
1830;13;1830/03/27;1763;197;BELLES-LETTRES;Poétique et Poésie;Français;Si... ! Mais hélas.... !;;Anonyme;;;;0 1/2;;8;;in-8°;;;;;;;;;;;;;;;;;;Fournier;Paris;Paris, place de la Bourse;Alex. Mesnier;;;;;;;;;;;;;;;;;En vers.;;
1830;13;1830/03/27;1764;207;BELLES-LETTRES;Théâtre;Français;Société en commandite du théâtre de l'Ambigu-Comique. Acte des 23 juin, 14 et 15 juillet 1829.;;Anonyme;;;;2 1/2;;20;;in-4°;;;;;;;;;;;;;;;;;;Moreau;Paris;;;;;;;;;;;;;;;;;;;;;
1830;13;1830/03/27;1766;210;BELLES-LETTRES;Romans et Contes;"Français;Anglais";"Télémaque anglais-français, traduction de Desmaiseaux, corrigée ; précédée d'une lettre sur l'étude de la langue anglaise par la méthode naturelle. Approuvé par M J. Jacotot.";;Anonyme;;Desmaiseaux;M. J. Jacotot;3 1/2;;84;;in-12;;;;;;;;;;;;;;;;;;Rossary;Lyon;Lyon;Louis Babeuf;;;;;;;;;;;;;;;;;(1829.);;
1830;13;1830/03/27;1767;210;BELLES-LETTRES;Romans et Contes;"Français;Italien";"Télémaque italien-français, traduit par M. de Forti ; précédé d'un rappel de la méthode naturelle appliquée à l'étude de la langue italienne. Approuvé par M. J. Jacotot.";;Anonyme;;M. de Forti;M. J. Jacotot;6;;144;;in-12;;;;;;;;;;;;;;;;;;Rossary;Lyon;Lyon;Louis Babeuf;;;;;;;;;;;;;;;;;(1829.) Contient les deux premiers livres : le texte est en regard de la traduction.;;
1830;13;1830/03/27;1770;216;BELLES-LETTRES;Philologie, Critique, Mélanges;Français;Une boutade, suivie d'un appel au public.;M. Chavard;;;;;0 1/4;;4;;in-8°;;;;;;;;;;;;;;;;;;Moreau;Paris;;;;;;;;;;;;;;;;;;;En prose, et relatif à M. Chavard et à M. de Rougemont.;;
1830;13;1830/03/27;1778;208;BELLES-LETTRES;Théâtre;Français;"Youli, ou les Souliotes, mélodrame en deux actes et en cinq tableaux ; représenté à Paris sur le théâtre du Cirque-Olympique le 17 mars 1830.";"M. Franconi jeune;M. Henri";"Collectif;Pseudonyme masculin";Liens familiaux;;;2 3/4;;44;;in-8°;;;;;1,50;;;;;;;;;;;;;David;Paris;Paris, rue du Temple, n. 5;;;;;;;;;;;;;;;;;;;;
1830;13;1830/03/27;1781;192;BELLES-LETTRES;Poétique et Poésie;"Grec;Français";Homère. Iliade, expliquée en français suivant la méthode des colléges par deux traductions, l'une littérale et interlinéaire, avec la construction du grec dans l'ordre naturel des idées, l'autre conforme au génie de la langue française, précédée du texte pur et accompagnée de notes explicatives, d'après les principes de MM. Port-Royal, Dumarsais, Beauzée et des plus grands maîtres. Traduction de Bitaubé, revue par M. E. Geruzez, agrégé des classes supérieures. Chant VIII.;Homère;;Enseignement;Bitaubé;M. E. Geruzez, agrégé des classes supérieures;4 1/12;;98;;in-12;;;;;2,25;;;;;;;;;;;;;Aug. Delalain;Paris;Paris, rue des Mathurins-Saint-Jacques;Aug. Delalain;;;;;;;;;;;;;;;;;;;
1830;13;1830/03/27;1786;192;BELLES-LETTRES;Rhétorique et Eloquence;Latin;Selecta Marci Tullii Ciceronis opera, notis illustrata, et in quatuor partes distributa. Pars prima, prosodiæ signis adornata, ad usum quartanorum. A. M. D. G.;Cicéron;;;;;7;;252;;in-18;;;;;;;;;;;;;;;;;;Rusand;Lyon;Lyon;Rusand;;;;;;;;;;;;;;;;;(1829.);;
1830;14;1830/04/03;1787;195;BELLES-LETTRES;Poétique et Poésie;Français;A l'hirondelle.;un élève de quatrième, à Soissons;Pseudonyme;"Âge;Contexte géographique";;;0 1/4;;2;;petit in-4°;;;;;;;;;;;;;;;;;;Impr. lithographique de Deletain;Château-Thierry;;;;;;;;;;;;;;;;;;;Douze vers alexandrins, par un élève de quatrième, à Soissons.;;
1830;14;1830/04/03;1789;215;BELLES-LETTRES;Philologie, Critique, Mélanges;Français;Agenda omnibus.;;Anonyme;;;;3;;108;;in-18;;;;;;;;;;;;;;;;;;Cordier;Paris;Paris, rue Beauregard, n. 11;Prêtres;Paris, rue Saint-Martin, n. 195;Vannier;;;;;;;;;;;;;;;;;
1830;14;1830/04/03;1799;194;BELLES-LETTRES;Poétique et Poésie;Français;L'astronomie, poëme en six chants.;P. Daru, de l'académie française;;"Contexte géographique;Sociétés savantes";;;19 3/4;;316;;in-8°;;;;;5,0;;;;;;;;;;;;;F. Didot;Paris;Paris, rue Jacob, n. 24;F. Didot;;;;;;;;;;;;;;;;;Ouvrage posthume.;;
1830;14;1830/04/03;1801;196;BELLES-LETTRES;Poétique et Poésie;Français;Le bal de l'aumône. Par Victor-Eugène Lecoupeur.;Victor-Eugène Lecoupeur;;;;;0 3/4;;12;;in-8°;;;;;0,50;;;;;;;;;;;;;Périaux;Rouen;;;;;;;;;;;;;;;;;;;En vers. Prix au profit des pauvres : 0-50.;;
1830;14;1830/04/03;1804;198;BELLES-LETTRES;Poétique et Poésie;Français;Cadet-Butteux à l'enterrement du bonhomme classique, revue pot-pourri, avec des notes.;M. Th. F.;Anonyme;;;;1 1/2;;24;;in-8°;;;;;;;;;;;;;;;;;;Trémeau;Angoulême;Paris;Auguste Guérin;;;;;;;;;;;;;;;;;Dans les notes se trouve un dialogue des morts (entre Boileau, lord Byron et Voltaire).;;
1830;14;1830/04/03;1805;213;BELLES-LETTRES;Romans et Contes;Français;Le Cardinal de Richelieu, chronique tirée de l'Histoire de France. Par M. James, traduite de l'anglais par l'auteur d'Olésia, ou la Pologne, etc.;M. James;Pseudonyme;Métiers du livre;l'auteur d'Olésia, ou la Pologne, etc.;;39 1/2;;948;4;in-12;;;;;12,0;;;;;;;;;;;;;Lachevardière;Paris;Paris, rue Saint-Germain-des-Prés, n. 9;Ch. Gosselin;;;;;;;;;;;;;;;;;Prix de chaque volume: 12-0.;;
1830;14;1830/04/03;1806;197;BELLES-LETTRES;Poétique et Poésie;Français;La caste jésuitique, ou Quinze ans d'intrigues, satire politique.;C. Beaulieu;;;;;1;;16;;in-8°;;;;;;;;;;;;;;;;;;Brunet;Lyon;Paris;marchands de nouveautés;Lyon;marchands de nouveautés;;;;;;;;;;;;;;;En vers.;;
1830;14;1830/04/03;1812;197;BELLES-LETTRES;Poétique et Poésie;Français;Chansons de Félix Becker, de Reims, ouvrier menuisier à Méru (Oise). Troisième livraison.;Félix Becker, de Reims, ouvrier menuisier à Méru (Oise);;"Autres;Contexte géographique";;;1;;16;;in-8°;;;;;1,0;;;;;;;;;;;;;Everat;Paris;Paris, place Vendôme;Lemoine;Beauvais;Dupont-Diot;;;;;;;;;;;;;;;Il y aura 12 livraisons.;;
1830;14;1830/04/03;1813;197;BELLES-LETTRES;Poétique et Poésie;Français;"Chansons de P. J. de Béranger ; précédées d'un Essai sur ses poésies, par Tissot.";P. J. de Béranger;;;;Tissot;15 1/4;;976;;in-32;;;;;;;;;;;;;;;;;;Rignoux;Paris;Paris, rue Neuve-des-Mathurins, n. 54;;;;;;;;;;;;;;;;;;;;
1830;14;1830/04/03;1820;211;BELLES-LETTRES;Romans et Contes;Français;La confession.;l'auteur de l'Ane mort et la femme guillotinée;Pseudonyme;Métiers du livre;;;17 5/6;;428;2;in-12;;une planche;1;;8,0;;;;;;;;;;;;;Duverger;Paris;Paris, place de la Bourse;Mesnier;;;;;;;;;;;;;;;;;;;
1830;14;1830/04/03;1823;214;BELLES-LETTRES;Romans et Contes;Français;Contes et nouvelles.;M. Merville;;;;;28 2/3;;688;3;in-12;;;;;;;;;;;;;;;;;;Tastu;Paris;Paris, quai Voltaire, n. 15;;Paris;Denain;;;;;;;;;;;;;;;;;
1830;14;1830/04/03;1825;206;BELLES-LETTRES;Théâtre;Français;La convalescente, comédie-vaudeville en un acte, représentée sur le théâtre du Vaudeville le 15 mars 1830.;"M. Mélesville;M. Varner";Collectif;;;;3;;48;;in-8°;;;;;1,50;;;;;;;;;;;;;Chassaignon;Paris;Paris, boulevart Saint-Martin, n. 29;Bezou;;;;;;;;;;;;;;;;;;;
1830;14;1830/04/03;1830;191;BELLES-LETTRES;Introduction et Langues;Français;Cours de langue anglaise théorique et pratique, approuvé et adopté pour l'usage de MM. les élèves du collége royal de la marine à Angoulême. Nouvelle édition.;M. Macfie;;;;;14 1/8;;226;;in-8°;;;;;;;;;;;;;;;;;;Trémeau;Angoulême;Paris, quai des Augustins, n. 47;Pichon et Didier;Angoulême, rue de Chandos;chez l'auteur;;;;;;;;;;;;;;;;;
1830;14;1830/04/03;1838;206;BELLES-LETTRES;Théâtre;Français;Décorations de Fra Diavolo, avec indication pour la mise en scène, les costumes et accessoires de la pièce.;;Anonyme;;;;0 1/2;;4;;in-4°;;une grande planche;1;papier de couleur;;;;;;;;;;;;;;E. Duverger;Paris;Paris, rue Rameau, n. 6;L. V. Duverger;;;;;;;;;;;;;;;;;In-4° d'une demi-feuille, sur papier de couleur et servant de couverture, plus une grande planche.;;
1830;14;1830/04/03;1843;189;BELLES-LETTRES;Introduction et Langues;Français;Dissertation sur les méthodes latines.;M. Tarneaud, chef d'institution à Limoges;;"Enseignement;Contexte géographique";;;1;;16;;in-8°;;;;;;;;;;;;;;;;;;Albin;Limoges;;;;;;;;;;;;;;;;;;;;;
1830;14;1830/04/03;1845;192;BELLES-LETTRES;Rhétorique et Eloquence;Français;Eloge de Charles-François Duc de Riviere, gouverneur de S. A. R. Mgr le duc de Bordeaux.;;Anonyme;;;;2 1/2;;40;;in-8°;;;;;;;;;;;;;;;;;;Pihan Delaforest Morinval;Paris;;;;;;;;;;;;;;;;;;;En prose.;;
1830;14;1830/04/03;1846;196;BELLES-LETTRES;Poétique et Poésie;Français;Epitre a Marie-Charles-Auguste D....., que ses parens voulaient forcer d'entrer dans un séminaire tenu par les jésuites. Par Auguste-Amable Marchal, étudiant en médecine.;Auguste-Amable Marchal, étudiant en médecine;;"Enseignement;Santé";;;1;;16;;in-8°;;;;;;;;;;;;;;;;;;Schuler;Strasbourg;;;;;;;;;;;;;;;;;;;;;
1830;14;1830/04/03;1847;"217;194";BELLES-LETTRES;"Poétique et Poésie;Polygraphes";Français;Epîtres de Voltaire.;Voltaire;Pseudonyme;;;;5 7/9;;208;;in-18;;;;;0,60;;;;;;;;;;;;;Lachevardière;Paris;Paris, quai des Augustins, n. 49;Lecointe;;;;;;;;;;;;;;;;;Fait partie de la Nouvelle bibliothèque des classiques français.;;
1830;14;1830/04/03;1851;208;BELLES-LETTRES;Théâtre;Français;Extrait de la tragédie de Sampiero. (Acte Ier, scène 2.);;Anonyme;;;;0 1/4;;4;;in-8°;;;;;;;;;;;;;;;;;;Marc Marchi;Ajaccio;;;;;;;;;;;;;;;;;;;Le fragment de 53 vers et demi de la tragédie dont Sampiero est le héros, est suivi d'une pièce de vers.;;
1830;14;1830/04/03;1865;214;BELLES-LETTRES;Romans et Contes;Français;Histoire de Valentin et Orson, très-hardis, très-nobles et très-vaillans chevaliers, fils de l'empereur de Grèce et neveux du très-vaillant et très-chrétien Pepin, roi de France.;;Anonyme;;;;15;;120;;in-4°;;;;;;;;;;;;;;;;;;Deckherr;Montbéliard;;;;;;;;;;;;;;;;;;;;;
1830;14;1830/04/03;1871;"217;210";BELLES-LETTRES;"Romans et Contes;Polygraphes";Français;Joseph, poëme;Bitaubé;;;;;7 7/9;;280;;in-18;;;;;0,65;;;;;;;;;;;;;Marchand-Dubreuil;Paris;Paris, rue Saint-Jacques, n. 156;;;;;;;;;;;;;;;;;;57e livraison de la Bibliothèque des amis des lettres.;;
1830;14;1830/04/03;1872;196;BELLES-LETTRES;Poétique et Poésie;Français;Las Casas, poëme en trois époques. Couronné (à Saint-Quentin) le 28 décembre 1829.;Félix Davin;;;;;4 7/8;;78;;in-8°;;;;;;;;;;;;;;;;;;Cottenest;Saint-Quentin;;;;;;;;;;;;;;;;;;;;;
1830;14;1830/04/03;1889;197;BELLES-LETTRES;Poétique et Poésie;Français;Ode à M. de Lamartine sur la mort de sa mère.;Pellet, d'Epinal;;Contexte géographique;;;0 3/4;;12;;in-8°;;;;;;;;;;;;;;;;;;Rignoux;Paris;;;;;;;;;;;;;;;;;;;;;
1830;14;1830/04/03;1890;"217;205;194";BELLES-LETTRES;"Poétique et Poésie;Polygraphes;Théâtre";Français;Oeuvres choisies de Sedaine. Tome Ier.;Sedaine;;;;;7 1/18;;254;;in-18;;;;;0,60;;;;;;;;;;;;;Lachevardière;Paris;Paris, quai des Augustins, n. 49;Lecointe;;;;;;;;;;;;;;;;;La table annonce une Notice par Sedaine qui n'est pas dans le volume appartenant à la Nouvelle bibliothèque des classiques français.;;
1830;14;1830/04/03;1891;194;BELLES-LETTRES;Poétique et Poésie;Français;"Oeuvres complètes de Boileau Despréaux, précédées d'une Notice sur sa vie par M. Daunou ; revues par M. Léon Thiessé.";Boileau Despréaux;;;;"M. Daunou;M. Léon Thiessé";80;;1280;3;in-8°;;;;;2,25;;;;;;;;;;;;;Crapelet;Paris;Paris, rue de Vaugirard, n. 17;;Paris;Houdaille;;;;;;;;;;;;;;;"Cette édition ne contient pas de variantes ; les vers ne sont pas numérotés : page 233 du tome 1, le vers 98 du second chant de l'Art poétique est ainsi : En peut-on admirer deux ou trois entre mille. Voyez sur ce vers ma note page 182-183 de 1824.";;
1830;14;1830/04/03;1892;204;BELLES-LETTRES;Poétique et Poésie;Français;Oeuvres complètes de Lord Byron, avec notes et commentaires, comprenant ses mémoires, publiées par Thomas Moore, et ornées d'un beau portrait de l'auteur. Traduction nouvelle. Par M. Paulin Pâris, de la bibliothèque du Roi. Tome 1er.;Lord Byron;;"Métiers du livre;Noblesse";M. Paulin Pâris, de la bibliothèque du Roi;Thomas Moore;31 1/2;;504;;in-8°;;;;;2,25;;;;;;;;;;;;;Dondey-Dupré père;Paris;Paris, rue de Richelieu, n. 47 bis;Dondey-Dupré fils;;;;;;;;;;;;;;;;;L'édition aura 12 volumes qui paraîtront de mois en mois. Le portrait sera donné avec le tome II.;;
1830;14;1830/04/03;1893;218;BELLES-LETTRES;Polygraphes;Français;Oeuvres complètes de Voltaire, avec préfaces, avertissemens, notes, remarques historiques, etc. (Tome V) Théâtre, tome IV.;Voltaire;Pseudonyme;;;;21;;504;;in-12;;;;;1,60;;;;;;;;;;;;;Allois;Versailles;Paris, quai Voltaire, n. 15;;;;;;;;;;;;;;;;;;Prix : 1-60. XVIIe et XVIIIe livraisons de l'édition annoncée en 50 volumes in-12.;Je ne sais pas si le prix est pour un seul volume, ou bien pour les deux qui sont regroupés sous la notice 1894 (JBM).;
1830;14;1830/04/03;1893;218;BELLES-LETTRES;Polygraphes;Français;Oeuvres complètes de Voltaire, avec préfaces, avertissemens, notes, remarques historiques, etc. (Tome Ier) Vie de Voltaire, par Condorcet.;;;;;Condorcet;22 3/4;;546;;in-12;;;;;1,60;;;;;;;;;;;;;Tastu;Paris;Paris, quai Voltaire, n. 15;;;;;;;;;;;;;;;;;;Prix : 1-60. XVIIe et XVIIIe livraisons de l'édition annoncée en 50 volumes in-12.;Je ne sais pas si le prix est pour un seul volume, ou bien pour les deux qui sont regroupés sous la notice 1894 (JBM).;
1830;14;1830/04/03;1894;218;BELLES-LETTRES;Polygraphes;Français;Oeuvres complètes de Voltaire. Tomes XXVI à XXXVII.;Voltaire;Pseudonyme;;;;166 7/18;;5990;12;in-18;;;;;1,25;;;;;;;;;;;;;Tremblay;Senlis;Paris, rue des Grands-Augustins, n. 18;;;;;;;;;;;;;;;;;;"Prix de chaque volume : 1-25. Ces volumes contiennent les Annales de l'empire ; l'Histoire du parlement ; Mélanges historiques (2 vol.) ; Politique et législation (2 vol.) ; Physique ; Philosophie (4 vol, ) ; et Dialogues.";;
1830;14;1830/04/03;1895;192;BELLES-LETTRES;Rhétorique et Eloquence;Français;Oraisons funèbres de Bossuet, évêque de Meaux. Nouvelle édition.;Bossuet, évêque de Meaux;;"Contexte géographique;Religion";;;25 3/4;;412;;in-8°;;;;;2,25;;;;;;;;;;;;;Fain;Paris;Paris, rue de Vaugirard, n. 17;Houdaille;Paris;Corbet aîné;Paris;Lecointe;;;;;;;;;;;;;;;
1830;14;1830/04/03;1896;206;BELLES-LETTRES;Théâtre;Français;Les Oubliettes, ou le Retour de Pontoise, pochade du XIIIe siècle, en deux actes, mêlés de couplets. Représentée à Paris sur le théâtre du Vaudeville le 6 mars 1830.;"M. Bayard;M. Masson";Collectif;;;;3 1/2;;56;;in-8°;;;;;;;;;;;;;;;;;;Chassaignon;Paris;Paris, boulevard Saint-Martin, n. 29;Bezou;;;;;;;;;;;;;;;;;;;
1830;14;1830/04/03;1897;196;BELLES-LETTRES;Poétique et Poésie;Français;Petite couronne poétique offerte à l'auteur d'Hernani, de Cromwell, de Han d'Islande, etc.;un classique;Pseudonyme;Autres;;;1;;16;;in-8°;;;;;;;;;;;;;;;;;;Lefebvre;Paris;Paris;Lefebvre;Paris, au Palais-Royal;Delaunay;;;;;;;;;;;;;;;;;
1830;14;1830/04/03;1900;213;BELLES-LETTRES;Romans et Contes;Français;"Le presbytère au bord de la mer ; traduit d'Aug. Lafontaine par MM. G..... et S.....";Aug. Lafontaine;"Anonyme masculin;Collectif";;"M. G.....;M. S.....";;45 1/12;;1082;4;in-12;;;;;;;;;;;;;;;;;;Danicourt-Huet;Orléans;Paris, rue Hautefeuille, n. 23;Arthus Bertrand;;;;;;;;;;;;;;;;;;;
1830;14;1830/04/03;1907;209;BELLES-LETTRES;Théâtre;Français;Scènes contemporaines sur l'administration en matière de ponts-et-chaussées.;;Anonyme;;;;1;;16;;in-8°;;;;;;;;;;;;;;;;;;Chassaignon;Paris;;;;;;;;;;;;;;;;;;;Ces quatre scènes sont extraites de la 19e livraison du Journal du génie civil.;;
1830;14;1830/04/03;1911;215;BELLES-LETTRES;Philologie, Critique, Mélanges;Français;Tablettes du solitaire d'Auteuil.;Legrand, officier de la garde royale;;Armée et maintien de l'ordre;;;5;;180;;in-18;;;;;;;;;;;;;;;;;;Fain;Paris;Paris, au Palais-Royal;Delaunay;;;;;;;;;;;;;;;;;Contient des morceaux en prose.;;
1830;14;1830/04/03;1913;190;BELLES-LETTRES;Introduction et Langues;Français;Théorie nouvelle et raisonnée du participe. Nouvelle édition.;Michel, auteur du Manuel administratif, de la Statistique historique, de la Biographie, de l'Annuaire;;Métiers du livre;;;7;;168;;in-12;;;;;1,50;;;;;;;;;;;;;Michel;Vezelise;;;;;;;;;;;;;;;;;;;;;
1830;14;1830/04/03;1914;213;BELLES-LETTRES;Romans et Contes;Français;"Tremaine, ou les Raffinements d'un homme blasé; traduit de l'anglais sur la quatrième édition par le traducteur de Dunallan.";;Anonyme;Métiers du livre;le traducteur de Dunallan;;39 1/12;;938;4;in-12;;;;;;;;;;;;;;;;;;Decourchant;Paris;Paris;Barbezat;;;;;;;;;;;;;;;;;;;
1830;14;1830/04/03;1917;208;BELLES-LETTRES;Théâtre;Français;"Un quiproquo au Rosendal, ou le Commissaire-priseur, vaudeville en un acte. Par MM. Gouchon et Herrewyn fils, de Dunkerque ; représenté sur le théâtre de Dunkerque le 15 janvier 1830.";"M. Gouchon;M. Herrewyn fils, de Dunkerque";Collectif;"Liens familiaux;Contexte géographique";;;4;;64;;in-8°;;;;;1,50;;;;;;;;;;;;;Drouillard;Dunkerque;Dunkerque;Drouillard;;;;;;;;;;;;;;;;;;"Je ne sais pas si ""de Dunkerque"" est en facteur commun ou s'applique seulement au second auteur. Dans le doute, je laisse le titre tel quel, avec les auteurs (JBM).";
1830;14;1830/04/03;1921;206;BELLES-LETTRES;Théâtre;Français;"Zoé, ou l'Amant prêté, comédie-vaudeville en un acte ; représentée sur le théâtre de Madame le 16 mars 1850.";"M. Scribe;M. Mélesville";Collectif;;;;3 1/2;;56;;in-8°;;;;;2;;;;;;;;;;;;;Dondey-Dupré père;Paris;Paris;Pollet;;;;;;;;;;;;;;;;;;;
1830;14;1830/04/03;1923;215;BELLES-LETTRES;Philologie, Critique, Mélanges;Allemand;Uber den Aufsatz im Hermes unter dem Titel : Villoison und Brendsted » « ein beitrag zur geschichte der plagiate » lies ein beitrag zur geschichte der pasquille : als Beilage zu den Keischen Untersuchungen. Von P. O. Brondsted. (Sur l'article de l'Hermès, intitulé : Villoison et Brondsted, etc. );P. O. Brondsted;;;;;4 3/4;;76;;in-8°;;;;;;;;;;;;;;;;;;F. Didot;Paris;Stuttgart;Cotta;;;;;;;;;;;;;;;;;;;
1830;14;1830/04/03;1925;204;BELLES-LETTRES;Poétique et Poésie;Italien;Al merito insuperabile della signora Malibran-Garcia.;;Anonyme;;;;0 1/2;;8;;in-8°;;;;;;;;;;;;;;;;;;Mie;Paris;;;;;;;;;;;;;;;;;;;Contient un sonnet et une ode.;;
1830;14;1830/04/03;1925;204;BELLES-LETTRES;Poétique et Poésie;Italien;Al merito insuperabile della signora Malibran-Garcia.;;Anonyme;;;;0 1/2;;4;;in-4°;;;;;;;;;;;;;;;;;;Mie;Paris;;;;;;;;;;;;;;;;;;;Contient un sonnet et une ode.;;
1830;14;1830/04/03;1927;217;BELLES-LETTRES;Polygraphes;Latin;Caii Plinii Secundi Historiæ Naturalis Libri XXXVII, cum selectis Harduini, Dalecampii, Bodæi, Girardi, Sprengeli atque aliorum notis et excursibus. Pars quinta, continens materiam medicam ex animalibus, curante J. B. F. S. Ajasson de Grandsagne. Volumen octavum.;Pline l'Ancien;;;;"J. B. F. S. Ajasson de Grandsagne;Hardouin;Daléchamps;Sprengel;Bodaeus;Girard;etc.";40 5/8;;650;;in-8°;;;;;;;;;;;;;;;;;;F. Didot;Paris;Paris;N. E. Lemaire;;;;;;;;;;;;;;;;;CXIV volume faisant partie de la 57e livraison de la Bibliotheca classica latina.;;
1830;14;1830/04/03;1929;"217;204";BELLES-LETTRES;"Théâtre;Polygraphes";Latin;M. Accii Plauti Comoedia, cum selectis variorum notis et novis commentariis, curante J. Naudet. Volumen primum.;"Plaute;Rotrou";Compilation;;;J. Naudet;41 3/4;;668;;in-8°;;;;;;;;;;;;;;;;;;F. Didot;Paris;Paris, rue des Quatre-Fils, au Marais, n. 16;Lemaire;;;;;;;;;;;;;;;;;CXIIIe volume faisant partie de la 57e livraison de la Bibliotheca classica latina. Ce volume contient Amphitruo, Asinaria, Aulularia, Bacchides, Captivi, et Casina, et le texte entier des Sosies et des Captifs de Rotrou.;;
1830;15;1830/04/10;1939;206;BELLES-LETTRES;Théâtre;Français;"Adrienne Lecouvreur, comédie en trois actes et en prose ; représentée sur le théâtre de l'Odéon le 12 mars 1830.";"M. Antoni Béraud;M. Valory";Collectif;;;;4;;64;;in-8°;;;;;;;;;;;;;;;;;;Barbier;Paris;Paris, au Palais-Royal, galerie de Chartres;;;;;;;;;;;;;;;;;;;;
1830;15;1830/04/10;1945;211;BELLES-LETTRES;Romans et Contes;Français;Athénaïs, ou Lettres de quelques personnes de ce siècle.;l'auteur d'Isabelle;;Métiers du livre;;;35 1/2;;852;4;in-12;;;;;;;;;;;;;;;;;;Tilliard;Paris;Paris, rue Hautefeuille, n. 20;;;;;;;;;;;;;;;;;;;;
1830;15;1830/04/10;1946;210;BELLES-LETTRES;Romans et Contes;Français;Aventures de Télémaque. Par Fénelon, augmentées d'une Notice sur la vie de l'auteur et de son éloge par Laharpe. Nouvelle édition, ornée de 25 gravures.;Fénelon;;;;Laharpe;42 7/8;;686;2;in-8°;;25 gravures (planches);25;;;;;;;;;;;;;;;Doyen;Paris;Paris;Philippe;;;;;;;;;;;;;;;;;La Notice sur Fénelon a deux pages.;;
1830;15;1830/04/10;1947;210;BELLES-LETTRES;Romans et Contes;Français;"Aventures de Télémaque. Par Fénelon ; précédées du Discours sur la poésie épique et sur l'excellence du poëme de Télémaque, par Ramsai.";Fénelon;;;;Ramsai;43;;688;2;in-8°;;;;;;;;;;;;;;;;;;Doyen;Paris;Paris;Lebigre;;;;;;;;;;;;;;;;;Il existe des frontispices avec l'adresse de Doyen.;;
1830;15;1830/04/10;1948;210;BELLES-LETTRES;Romans et Contes;Français;Les Aventures de Télémaque. Par Fénelon, suivies des Aventures d'Aristonoüs. Nouvelle édition, revue avec soin et augmentée de variantes et d'une table mythologique et géographique.;Fénelon;;;;;18;;432;;in-12;;;;;;;;;;;;;;;;;;Poussielgue-Rusand;Paris;Paris;Rusand;Lyon;Rusand;;;;;;;;;;;;;;;;;
1830;15;1830/04/10;1949;216;BELLES-LETTRES;Philologie, Critique, Mélanges;Français;Avis au lecteur, Epître aux dames, Dialogue entre mon cœur et mon esprit, proverbes, adages, etc., le tout devant précéder le Roman du cœur, poëme historique en dix chants, et composé de plus de cinq mille vers.;A. Lanson;;;;;1;;16;;in-8°;;;;;;;;;;;;;;;;;;Guyot;Paris;Paris, rue du Coq, n. 13 et 15;Hautecœur-Martinet;;;;;;;;;;;;;;;;;"Les trois premières pièces sont en prose ; les pensées, etc., sont en vers alexandrins.";;
1830;15;1830/04/10;1953;208;BELLES-LETTRES;Théâtre;Français;Camille, ou le Patriotisme, tragédie en cinq actes et en vers.;M. Fréd. Galeron;;;;;4;;64;;in-8°;;;;;3;;;;papier vélin;6;;;;;;;;Brée;Falaise;Caen;Mancel;Caen;Chalopin;Paris;Lance;;;;;;;;;;;;;Tiré à 200 exemplaires, dont 50 seulement ont été mis dans le commerce.;On ne sait pas combien de ces 200 exemplaires sont sur papier ordinaire et combien sur papier vélin (JBM).;
1830;15;1830/04/10;1964;193;BELLES-LETTRES;Poétique et Poésie;Français;"Dictionnaire portatif des rimes françaises ; rédigé d'après l'académie.";P. A. Delanneau, fondateur de l'institution Sainte-Barbe;;Enseignement;;;4 1/2;;288;;in-32;;;;;;;;;;;;;;;;;;Doyen;Paris;Paris, quai des Augustins;Froment;Paris;Berquet;;;;;;;;;;;;;;;;;
1830;15;1830/04/10;1969;211;BELLES-LETTRES;Romans et Contes;Français;L'élève du chanoine, ou les Strasbourgeois en 1592.;F. Cobourg;;;;;4 5/6;;116;5;in-12;;;;;;;;;;;;;;;;;;Dentu;Paris;Paris;Dentu;;;;;;;;;;;;;;;;;;;
1830;15;1830/04/10;1970;196;BELLES-LETTRES;Poétique et Poésie;Français;Epître a M. de Bourmont, ou Son histoire en vers burlesques.;M. J. D. A. N.;Anonyme;;;;2 3/8;;38;;in-8°;;;;;2,0;;;;;;;;;;;;;David;Paris;Paris;tous les marchands de nouveautés;;;;;;;;;;;;;;;;;;;
1830;15;1830/04/10;1974;215;BELLES-LETTRES;Philologie, Critique, Mélanges;Français;Essais de littérature. Tome Ier.;J. J. Leroux;;;;;13 3/8;;214;;in-8°;;;;;;;;;;;;;;;;;;Didot jeune;Paris;;;;;;;;;;;;;;;;;;;Dans l'Avertissement, l'auteur dit n'avoir presque rien fait imprimer que la Journée de Salamine, dont il existe deux éditions : voyez n. 134 de 1822. M. J. J. Leroux est aussi auteur du Cours sur les généralités de la médecine, 1825 et années suivantes.;;
1830;15;1830/04/10;1980;206;BELLES-LETTRES;Théâtre;Français;"Harnali, ou la Contrainte par cor, parodie en 5 tableaux et en vers ; représentée sur le théâtre du Vaudeville le 23 mars 1830.";M. Auguste de Lauzanne;;;;;2 3/4;;44;;in-8°;;;;;2,0;;;;;;;;;;;;;Chassaignon;Paris;Paris, boulevard Saint-Martin;Bezou;;;;;;;;;;;;;;;;;;;
1830;15;1830/04/10;1988;189;BELLES-LETTRES;Introduction et Langues;Français;La langue française et l'orthographe enseignées par principes et en 24 leçons, ou Grammaire française, à l'aide de laquelle on peut seul, et sans le secours d'aucun maître, apprendre à parler et à écrire correctement cette langue. Ouvrage, etc. Trente-septième édition, revue et augmentée, etc.;M. Fournier;;;;;5 1/2;;132;;in-12;;;;;1,25;;;;;;;;;;;;;Pillet aîné;Paris;Paris, rue de l'Hirondelle, n. 22;Germain Mathiot;;;;;;;;;;;;;;;;;;;
